<?xml version="1.0" encoding="UTF-8" ?>
<Bookstore xmlns="http://www.sages.com.pl/jrest/jaxb" xmlns:xsi="http://www.w3.org/2001/XMLSchema-instance" 
           xsi:schemaLocation="http://www.sages.com.pl/jrest/jaxb Bookstore.xsd">
    <Book ISBN="ISBN-0-13-713526-2" Price="85" Edition="3rd">
        <Title>W Pustyni i w Puszczy</Title>
        <Authors>
            <Author>
                <First_Name>Henryk</First_Name>
                <Last_Name>Sienkiewicz</Last_Name>
            </Author>
        </Authors>
    </Book>
    <Book ISBN="ISBN-0-13-815504-6" Price="100">
        <Remark>
            Buy this book bundled with "A First Course" - a great deal!
        </Remark>
        <Title>Database Systems: The Complete Book</Title>
        <Authors>
            <Author>
                <First_Name>Hector</First_Name>
                <Last_Name>Garcia-Molina</Last_Name>
            </Author>
            <Author>
                <First_Name>Jeffrey</First_Name>
                <Last_Name>Ullman</Last_Name>
            </Author>
            <Author>
                <First_Name>Jennifer</First_Name>
                <Last_Name>Widom</Last_Name>
            </Author>
        </Authors>
    </Book>
    <Magazine Month="9" Year="2016" Price="22">
        <Title>Å»agle</Title>
    </Magazine>
    <Magazine Month="1" Year="2015" ISBN="ISBN-0-13-815504-8">
        <Title>Programista</Title>
    </Magazine>
    <Magazine Month="2" Year="2015" Price="12">
        <Title>Programista</Title>
    </Magazine>
</Bookstore>